,title,stars,date,r_title,text
163,Shrek the Third,,4 June 2007,Shrek the third..... June 2007,"In my opinion, the movie Shrek the third, is a great movie!!! I like very much the message of the movie, because, it make us to see that we can be wherever you want and we must not influence for the opinion of the people.But in counterpart, Shrek the third, is not so good like other parts of Sherk. I think that the all public was waiting more of the third part because the second part of Sherk wan an incredible an amazing movie In Sherk the third, exists a part of movie that doesn't catch my attention, but lucky for the movie, there exist the prominent figures like the donkey and the cat with boots that always make you smail and to save the movie."
164,Shrek the Third,4,4 June 2007,"""Whose ready for thirds?""-after viewing, not me.","Shrek was great. Shreak 2 was very, very good. Shrek 3 was poor, at best.I mean, is comedy that hard to write? Shrek is supposed to be, you know, funny. Merlin (Eric Idle) was great, and Pinochio has (near the end) a great bit, but the rest is lacking in humor.The plot was clear, and drawings/renderings superb (the best yet, IMO), and each individual character was played well. But the script was lacking in humor. It did have it's moments, but overall, it was dry. Blame the writers, not the actors, for this one.I gave it a 4 because it was better than Pirates 3, but that is not saying much."
165,Shrek the Third,,3 June 2007,Born to be king.,"Takes place sometime after the events in the Shrek 2. King Harold is at a dying state. And when he pasts away Shrek will have to take his place as king. Shrek however, doesn't want to take that role, as he'll have to leave his swamp for it. In luck, Fiona has a cousin name Artie, who is next in line to be king. So Shrek, Donkey, & Puss N Boots head out on a journey to find Artie and convince him that he's going to be the new king of Far Far Away. Besides that Shrek was asked by Fiona about how great it be if they'd start a family. He of course isn't too found of being a father as ogre babies are more rampaging than regular babies. And keeps having nightmares about it during the journey.Meanwhile Prince Charming, has been a laughing stock for what had happened in the previous film. For that he goes to the Poison Apple to cheer up all the fairytale villains that there's still hope in getting their own ""happiley ever after"". Will Shrek be able to over come his fear in becoming a father? Will Artie successfully become king? And will Charming be stopped for his plot to take over Far Far Away? For only being the third installment, Shrek the Third contains the usual and running gags, copyrighted music, and in jokes. However it feels much different than the first 2 as the opening and closing of it are made differently. I like how they used some ideas that weren't thought up in the previous 2, as well as more background character to spot throughout the movie. The downside is it's not above or the same as the first 2. As some of the scenes are obvious and a few that can be seen a mile away. I guarantee that there'll be more 3 funny scenes in the movie.But overall it's either a you like it or you don't like it movie. If you're a die hard Shrek fan, then you might like it."
166,Shrek the Third,7,3 June 2007,Getting in Its Own Way,"""Shrek the Third"" is funny and has big laughs throughout, and one gets the feel that this installment of the big green guy's story is completely unnecessary. The cryptic symptom of Shrek's demise is somewhat insidious. All the big laughs come from the supporting characters namely Pinocchio (Cody Cameron) and the Ginger Bread Man (Conrad Vernon). Justin Timberlake voices a great turn as Artie, heir to Far Far Away Throne. He has a great scene where he says, ""Sometimes we all get in our own way"" This wonderful sentiment is so misplaced in this feeble attempt to empower faith in oneself. Also the movie should have heeded its own advice. ""Shrek"" the first was endearing in its message of seeing beyond appearances and finding the value of a person's or ogre's soul. ""Shrek"" also had a great sense of humor about life and itself. Apparently, the makers of ""Shrek the Third"" have forgotten this legacy. And there are too many involved. Chris Miller is director along with co-director Raman Hui. Still based on the original book by William Steig, there are a horde of writers: Jeff Price, Peter Seaman, J. David Stern, David Weiss, and Jon Zack. Consequently, ""Shrek the Third"" is blurred. The movie is funny; however, the laughs are of the sitcom nature. Some of the gags themselves are bewildering. For example, the extended death scene of King Harold (John Cleese) gets old until he finally ""croaks"", so to speak. The playing of Paul McCartney and Wings' ""Live and Let Die"" at the funeral is out of place and irrelevant. Also who is the main audience of ""Shrek 3""? Old people like me or kids? Kids don't know Wings, much less The Beatles. ""Shrek the Third"" is perfunctory funny, but the fairy tale well has gone dry. Rather the writers did not create something fresh, instead polishing a retread.As ""Shrek the Third"" opens we find Prince Charming (very funny Rupert Everett) doing very bad dinner theater. Shrek (Mike Myers) and Finona (Cameron Diaz) are filling in for the royal duties of Far Far Away Kingdom, and not really having a good time. So when the King finally dies, Shrek is next in line to the Throne. Unless Shrek can convince Prince Artie (Justin Timberlake) to assume the kingly duties, he will be unable to return to his beloved swamp. Thus, Shrek along with sidekicks Donkey (Eddie Murphy) and Puss In Boots (Antonio Banderas) embark on mission to retrieve young Artie. Meanwhile, Fiona and mother Queen Lillian (Julie Andrews) remain in Far Far Away. Fiona also confesses to Shrek before he leaves, that he will soon be a father. Shrek outwardly does not assume the tower of fatherhood. A ridiculous subplot involves Prince Charming's claim to the Throne. High jinx abound, and there are some touching heart to heart conversations between Shrek and Artie. Unfortunately, nothing really special distinguishes this third go round of the lovable Ogre. The supporting characters seem to corner the market on all the funny lines. Mike Myers, Eddie Murphy, and Antonio Banderas are all great as Shrek, Donkey, and Puss. Cameron Diaz seems relegated to the sidelines in this outing. Rupert Everett provides comic relief as the totally self absorbed and clueless Prince Charming. Perhaps, the movie's only freshness comes from Justin Timberlake as Artie.Other than Timberlake's Artie, ""Shrek the Third"" really shows signs of wear and tear. Here ""Shrek 3"" even eludes its connection to pop culture. There is a forced ""hip-hop"" conversation between Shrek and Artie. ""Shrek the Third"" suffers from a stand alone gag structure. There is no coherence. Perhaps, all of the charming and sweet fairy tale essence has been weaned dry. The message near the end about believing in oneself is noble, but seems tacked on and out of context. ""Shrek the Third"" is over wrought, funny, and really not worth seeing. Perhaps, ""Shrek 4"" will recapture some of what made it so special. Then again, it may be time to move on to something new."
167,Shrek the Third,6,3 June 2007,Shrek the Thud,"""Shrek"" was a delightful film, featuring a fresh animation style and a lovable ogre. Unfortunately it made a lot of money; hence, the inevitable sequels. This one is less than inspired, with a tired script that seems to run out of ideas. The comedy is stale, with only a few chuckles here and there. The funniest bit is the frog king, whose death scene drags on forever. The all-star cast of voices is nice but cartoons are only as good as the story. There are too many characters crammed into a flimsy plot. As a result, it feels episodic and underwhelming. The worst part is knowing that Shrek IV is on the horizon."
168,Shrek the Third,4,2 June 2007,The third the worst by far,"No story, no fun, no personality. I think this is the summary of the film. First one was something new, fresh air. Second one was a little bit irregular but with unforgettable moments and new and great characters, I think (and this is a very personal opinion) the second one is even better than the first one,there is something really charming and touching in there. Third one is just dull, in my view it should not have been released in theaters. Where are the witty dialogs? Where are the witty references to popular films? Where is the magic? Where is the story? Even the soundtrack is worst in this one. A piece of advice... don't waste your time watching this in theaters, look for something else.Disappointing."
169,Shrek the Third,6,2 June 2007,Many small laughs does not a make good movie,"That's what the whole movie is made of - many disjointed small jokes and humor to string together to storyline that is too one dimensional. The main story is so typical - it's for kids. But yet, small kids may not understand many of the humor. There are so many characters taking turn to show off but none that is deep enough to captivate the audience. You might hear the whole theater roaring with laughter at some times, but in the end, it was just not as entertaining as the previous two Shrek movies.Nevertheless, the graphic details is amazing. Thanks to the graphics designers and computer technology, the animation is delightful to watch."
170,Shrek the Third,4,2 June 2007,"If you must see it, see it only once.","The thing about the Shrek series is that it's great for families and adults too. It's sad to say the adults won't enjoy this one even though the kids will but then again, kids will eat up any computer animated film that comes their way. It's true that all of the characters are back but besides a few jokes that really hit, most of them are just bad jokes. Not good bad jokes either, just jokes that really miss and will make you wonder if what just happened is supposed to be funny. Also, Justin Timberlake's character is annoying (although I guess he's supposed to be a brat) and the minor characters aren't given nearly enough to say. This is entertaining enough to finish watching once but repeated viewings will not hold up. Considering that this is the Shrek series and how entertaining the first two were, that's very bad."
171,Shrek the Third,5,1 June 2007,Only for the kids!,"As always the highly anticipated sequel doesn't live up to the originals. While i was sitting watching i could feel my eyes slowly falling asleep. Maybe it was the caffeine from the coke or just the fact that this movie was incredibly slow for me. All the actors did great jobs, as they did previously. The basic plot of the movie revolves around finding the new king on Far Far Away but they run into a bit of trouble along the way. The movie has funny parts and insanely long moments of slowness. I would recommend only going to see this with children. They would love it! Personally I did not.Ash"
172,Shrek the Third,5,30 May 2007,A little bit of a let down,"This movie in the trilogy was a bit of a let down. The jokes were old, the story okay and characters tired. It would have been better if the first two movies were not so spectacular. I guess everyone in Hollywood is needing to cash in on a money maker for their babies mama's (Eddie Murphy). The interaction was bland and plot not much better. Prince charming was blah, and Cameron Diaz was just as boring. They belong together. Children will enjoy this as they do not know any better. Parents, you might want to bring a book along. I doubt there will be a fourth movie in this set. Between this and spiderman sucking this year, it is not a summer for movies."
173,Shrek the Third,6,29 May 2007,Fairy tale baddies seek revenge and Shrek goes on a quest to avoid the throne.,"THE FROG KING RULES!!! -Well anyway, that was the funniest scene in the whole movie and it came early so after that hilarious and promising bit Shrek 3 was only mildly amusing. I felt there were some missed opportunities in making some scenes funnier by what was shown and/or said. As I watched, I found myself saying, ""They should have done this instead of that"" or ""said this instead of that"".Shrek 3 is ""average"" and so I'm giving it 5 stars + 1 for the frog king = 6. It is best for children, I think; If I were a kid I'd give it 9 or 10 stars for cuteness and animation alone. But a grown person needs a little bit more edge, imagination, and cleverness than is offered; a bit more ""meat and potatoes"", if you will. There are, for example, many hard-headed prisoners who I'm sure would agree that it's not as simple as is portrayed towards the end of the movie. Couldn't they have come up with something ""less straight forward?"" Like maybe a ""key"", for instance (chuckle! chuckle!) So my final 2 cents is this: Highly recommended for kids (under 12, I'm thinking). Mildly amusing for Adults (except for the frog king scene, of course; that was a scream). Love, Boloxxxi."
174,Shrek the Third,,29 May 2007,Shrek 3,"Before I comment on it, to say the truth, I don't like watching Shrek movies. They are boring and not funny enough. I am not sure why I am watching this movie, is it because I heard it was good? I am not sure what came to my mind watching this. I thought of an excuse, a one good excuse is I love seeing the cute Puss in the boots. He is a character that makes the movie likable, in my reasons. I am not sure about that. All right, I have to admit that some jokes got me but the problem is that since this is made for kids, you can't expect big action or much potty humour, oh well, maybe I like watching big action. It is pretty like the previous Shrek movies, with more characters. The point...why can't the director make it exciting so that we don't have to say ""Oh my! It's another Shrek movie, and why do I feel like I have watch this before."" But, I have to say this one is better than the previous Shrek movies. In my choice, often the third part is better than the second and the first movies.If you have nothing better to do, like me, you might want to catch this or if you are a fan of Shrek, this suits you."
175,Shrek the Third,5,28 May 2007,"You Can Dress Up an Ogre All You Want, But....","Interesting, this. With this series, Dreamworks has somehow built a seemingly unstoppable franchise on a foundation of unoriginality. In fact nearly every element of these is a reference to some other film. Instead of writing a joke, these guys simply refer us to another joke we remember from some other movie. We don't laugh, we re-laugh.The mainstream movie business seems to be leaning this way. Entire films are being shot as I type this based on nothing more than fond remembrances. Thin nostalgia. It's actually shrewd business tactic at its best. The idea is to double your demographic: Target kids AND their parents. Whatever was a fad for you when you were 7 years old is sure to re-emerge when your kids are that age. It's also the opposite of what say, Pixar does, which is to actually engage the viewer on a deep level. To take our imaginations somewhere instead of just our memories.Until this. Well, sort of. This is the first offering by Dreamworks Animation Studios that I know of that at least tries. That it fails is beside the point. They should be applauded for effort.It's their first attempt at clever construction, and here's the idea: The story here is told on 3 levels simultaneously. The first (and most annoying) is our collective experience in movie-land. Second is the movie proper, the irrelevant tale of an ogre and a future king. Third is the staging of a play, which is actually based on the other two levels.If the first two levels are mild celebrations on movies themselves, the important third is a lavish ticker-tape parade, and was the missing element in the first two Shreks. Ultimately though, I'm not sure it's possible to pull this off when you're constantly dragging your audience's intelligence down with all those toilet jokes. Maybe next time they'll lower their poop-joke quota.Wonder if Dreamworks has a future king in their midst."
176,Shrek the Third,5,27 May 2007,What is old gets made into a sequel,"Ever since I was a little kid, I had a love/hate relationship with movies and books. I loved how they both created worlds of extraordinary people and creatures that I came to think of as friends. I hated that no matter how many follow up projects were made, eventually I would only be able to visit these characters by re-watching or re-reading their adventures. These visits were nice but not nearly as exciting since I already knew the outcome of the stories.Shrek the 3rd (2007) is a movie that brings back characters I know and love from the previous two films. There is the ogre Shrek (Mike Myers), the grumpy curmudgeon who has learned to make friends and care about other as well as his wife Fiona (Cameron Diaz), a princess that has learned to accept her inner beauty regardless of her outer looks. Donkey (Eddie Murphy), the lovably obnoxious mule that has learned nothing so far is back as well as the adorable and suave Puss N' Boots (Antonio Bandaras). All the characters are exactly as I remember them. Come to think of it, everything is exactly as I remember it. Nothing has changed for any of them.For me, Shrek the 3rd is like having friends come over to visit but they have nothing new to say. Every sentence starts ""remember when"" and no new memorable moments are created. Your only hope is that since everyone is a bit older, they will not stay as long. Unfortunately, this movie lasts as long as the more entertaining and original films it is following.As the movie begins, Shrek, Fiona and the gang are in Far, Far Away helping to run the kingdom while the king is sick. Eventually the frog king croaks (hey, if they can use lame humour to make this film  I can use it while discussing it!) and Shrek is told he is next in line for the throne. He doesn't want to be king so he sets out with Puss and Donkey to find the next heir to the throne. While away, Prince Charming (Rupert Everett) tries to steal the throne with the help of other fairy tale villains and it is up to Fiona and the other princesses to stop him. By the end of the film, everything is back to normal with the exception of a few additions to the cast.So, Shrek is grumpy, Donkey is obnoxious and Puss N' Boots is cute. All the jokes surrounding these character traits feel recycled from the first two films which only add to my feeling that this movie was only made to cash in on the successful franchise. After all, there is no reason to invest in a better script when crowds of families will come and see whatever these characters are in. I know that all Hollywood movies are made to make money but I feel less a victim if they at least appear to care about the final product.Sequels and prequels are not automatically void of artistic value and merit. Not only can they continue to tell a story that is too large for one film, like the Star Wars Trilogy (or is it now considered a sextet?), these films can also concentrate on other characters in their universe to give them a chance to tell their stories. Does the lack of originality for Shrek the 3rd indicate that these characters have no new stories to tell? Should we be satisfied with mediocrity just as long as we get to see characters we enjoy? Well, since Shrek 4 and a Puss N' Boots spin off film have already begun talks, I guess only time will tell if they are going to breath life into this franchise. Until then, I will have to be happy revisiting these friends through the first two films and try my best to forget that the 3rd film even happened."
177,Shrek the Third,4,27 May 2007,Shrek the Turd,"This movie was a waste of money and time. I'm sure the producers will disagree and they will make millions based on promotional sales and products they disperse to consumers, but not me. The first Shrek was good, original and funny. The second was less funny and less original, the third just plain stunk. The characters were the same as always, no development or any great new characters, Artie was not a great new character, just a new one. The plot was boring, Shrek does not want to be the new king of Far, Far Away and looks to have Artie take his place. I went in on the idea there would be more mayhem from Shrek's new children, but they never developed until the last few minutes, less some nightmares that Shrek had. The jokes were plentiful, the laughter was less often. The one thing that I thought truly stood out from the second Shrek is the voice-overs were much better coordinated/in sync with each other this time around, which gave a better stage presence of the voices. But I will not be buying the Third on DVD, even if it goes down to $7.44 at wal-mart, to me this movie will go down as Shrek: the Turd"
