,title,stars,date,r_title,text
226,Shrek the Third,7,21 July 2007,not as bad as they say :),"i saw this movie last evening and i was not disappointed :)I thought this movie was funny and still keep the great ""shrek"" humor. But the story in this movie was maybe not as great as in the first two. And the movie is so fussy and prepare that it was amazing. You could see a pore on skin. And there was one chapter in the movie there i was choking in the seat of laughter. But still a great movie but i'm not saying that they should make another film, rather that. Shrek 3 is nearly as good as Shrek 2.And there were lot of a new persons and that was good :)But i was pleased this movie is good."
227,Shrek the Third,9,14 July 2007,Good Movie and a Really great Message....,"Hmm...I know quite a few here have not liked this movie when compared to Shrek and Shrek 2, but let me tell you every Shrek movie is great on its own and should not be compared! Each movie has a beautiful message at the end..and this one I think tops them all...Believe in yourself...The movie is really good with some really good laughs..like the scene where Prince Charming asks the ""puppet"" "" Where is Shrek ? "".... I am still trying to figure what was said! Anyways, please go and see this movie if you are a Shrek fan...and if not you will become one....."
228,Shrek the Third,7,12 July 2007,Undeserving of such censure...,"OK so it's not as laugh-aloud as the previous two, but that's because the Shrek franchise has grown up. There are some silly moments just to get laughs (and yes, they do bring up the word ""poop"" more than enough times just to get kids laughing) but I still enjoyed this movie - and I'm 23.I think that adults will possibly enjoy this more than the kids - some of the gags are more subtle, or too adult for littler children to understand. For example the horn ""bleeping"" out certain words, or Artie's fake temper tantrum (funny for adults, kids won't get the joke as it's probably something they do themselves).That in NO way makes this a bad, boring or tired movie. I just think you have to watch this film expecting something different that appeals to a more adult point of view. Unfortunately if you go into this expecting in-your-face, obvious, don't-have-to-think-about-it laughs like the kids will, you are probably going to be disappointed. But DO give this film a go - you will be pleasantly surprised."
229,Shrek the Third,7,8 July 2007,3rd Times a Charm - or is it?,"A few years ago we got Shrek - the anti fairy tale hero and a movie that made fun of the fairy tales and concepts that Disney has spewed out over the years and as a result we got a fresh, fun and quirky children's film which had some great adult humour too. A sequel followed and who didn't fall in love with Puss in Boots? 2007 is the year of the trilogy and after the letdown of SM3 and POTC3 it is now Shreks turn to attempt an adequate 3rd helping.Did it succeed? - I just don't know. Not exactly a committed statement from someone who is attempting to review the movie, but I cant figure out if it was good or as good as its predecessors.The cast were all back and the voices all great as usual - no real qualms there.The plot - The King dies (in a very funny scene!) and leaves Shrek the new King unless he can persuade a young Arthur, a relative of the Kings to take the throne. Whilst Shrek is off on his quest to persuade Artie to become the new King of Far Far Away Charming enlists the help of the villains and losers of fairytale lore and invades the Kingdom determined that they, for a change, should be the ones to have a happy ending - and to put the icing on the cake - Fiona is pregnant! As usual Pinocchio, Gingy, The Three Pigs and the Wolf are all back to help and are as amusing as they have ever been.There are some very amusing scenes with Snow White, Cinderella and Sleeping Beauty, who in all honesty were much much funnier than Donkey and Puss. More screen time with them would've been greatly appreciated. I hated Snow White when I was a kid but after seeing her turn all bad ass and sing the Immigrant Song I have changed my opinion.Artie also had some fun scenes - the overacting scene was very funny!! It was actually Prince Charming who stole the whole show with his very evil, yet also very camp plan to kill Shrek during a play he and the other villains were performing. It was all a bit odd but still amusing non the less.I felt that Donkey and Puss were a little underused and that the inevitable body swapping storey arc was thrown in at the last minute. It wasn't that funny, or to be honest necessary.I thought that there were less fart and poop jokes than usual but they were saved until the end of the movie for Shrek and Donkeys kids and lets not forget Shreks ""poop speech"" This brought a huge wave of silence as those types of jokes stopped being funny a long time ago - and I went to a Sunday afternoon matinée! I did laugh at parts though and there were some genuinely funny and clever scenes don't get me wrong but it just felt that something was missing.As usual the soundtrack was fun with some good songs on there - not overly convinced by Fergies version of Barracuda but that's a minor issue.Overall I would give it 7/10. It loses a point automatically for being a sequel (personal rule), losses another for the under use of Fiona, Puss and Donkey and a final point for the very unfunny body swapping idea.Kids will love it of course, but the magic and spark that attracted adults attention in the first one has definitely gone. It will make millions at the box office and even more in toy and game sales but lets have Shrek end on a reasonable high. It wasn't as much of a let down as some the threequels we have had this year but the franchise has all but run out of steam. Lets just have the Puss in Boots spin off to create some freshness to a very good franchise ."
230,Shrek the Third,3,4 July 2007,Shrek ....... the lost plot!,"What on earth happened to Shrek? Having waited for months for the new film to be released, my experience last night watching it at the cinema was such a let down! The banal, nay, non-existent plot started some 10 minutes after the only interesting scenes in the film. Did the opening writers/directors die after this opening and were replaced by automatons working on the basis that Shrek fans would come to watch any old rubbish and still applaud? What might have saved the film from complete boredom would have been the music which in the previous films has been terrific and could have stood alone. But what did we get? Two decent pieces of music and zilch else! Who could forget the terrific songs from Shrek 1 & 2 but 3 .... forget it!! Have the producers of the Shrek series become totally complacent, are they lying back counting their millions content to offer this rubbish to the cinema-going public and unashamedly take our money? If Shrek 4, now in production, is going to redeem this film then the paying public needs to tell the film makers that they got this one badly wrong, and they need to sack the writers and directors of this ""turkey"" and get back to the format that made 1 & 2 such a success"
231,Shrek the Third,3,1 July 2007,Had higher hopes for this one....,"Compared to part one and part two, the third movie really stank. Shrek was pretty good and pretty funny. Part two was just Great! Lots of music and I cant get my son to stop watching it. Than going to see part three I expected it to be even better but it FLOPPED! There was hardly any music sections, they took out key characters.Throughout the whole movie I was waiting to see if fairy god mother was going to return. Prince charming and the mother were very funny and added more action. They killed off the father and totally made it very unappealing. I know you need humor but not about someones death.Donkey was not doing much talking and he is the funniest character of ALL! Also Pinocchio and the gang should have been more active in the show because they do add more humor.There was a lot of music missing and why did they throw in a wacky wizard. How funny is that going to be to a bunch of school ages children? Not much, my son asked me to leave in the middle of the movie because he did not like it.The movie makers should have made it more like part two with the singing, humor for children to understand and with adult humor that part two was full of.If they are setting this movie up to be a series than they did a poor job. Personally this movie sucked."
232,Shrek the Third,4,29 June 2007,An animation movie for kids - Adults better look trailer only,"I was always a very big shrek fan and I was really looking forward to see the third movie in the theater. The Belgian critics already warned that this third movie is not like its predecessors, and I went to the theater with no expectations. I was really disappointed when after half an hour watching I was already bored like hell. Many people will not want to believe that it is possible to ruin such a successful movie series which had so many great characters in the two previous ones. Seems dreamworks is thinking more about money and franchising than about entertaining the audience with the double sensed good humor they always used. Instead of giving more of the characters like puss and donkey, they added up a bunch of characters with no personality It was shocking to see that the funny moments of the trailer almost all showed up in the first seven minutes of the movie. The moment shrek and his bunch go to search for Artie the movie starts to be really boring with in between (very) few moments with the good old humor that made 1 and 2 very amusing.Dreamworks had so many potential with the new fairytale characters but instead of working out a few of them and to make a strong movie, they overwhelm us with every character you ever heard of in a fairytale in such a fast time that you are not even realizing who is all in it.The new main character of Artie is just sad and boring. They didn't even did the effort to make him a bit funny and you will only see him giving stupid moral speeches, having a father son moment or playing a drama actor. Add the whole high school language humor and an annoying prince charming musical which together make the movie so dull that the moments with donkey and puss can't rescue the movie anymore. Luckely these two characters where in it or the movie would be rated 1/10 by me.With the situation at the end (triplet shreks) I am curious how dreamworks is going to make a fourth movie. I really hope they learn from there mistakes and restore the good old humor in the fourth one.Anyhow this is just an adult opinion, there were kids in the audience and they seemed to like it a lot."
233,Shrek the Third,6,26 June 2007,"i have to say, i was a bit disappointed","As i loved Shrek 1 and 2. I felt that this had no real funny parts. after rolling on the floor for the first two i only had a few laugh out loud moments. and i'm sorry but when the queen battered through the wall with her head i was just like ?where did that come from? but on the plus side, donkey and dragon babies were very cute! and Justin Timberlake did better than i thought he would- although he did have one of those long preachy cant we all just get along speeches. I also liked the idea of using all the story princesses as a kind of Charlie's angels (appropriate)Definitely not a rubbish film, but maybe they should of stuck at 2?"
234,Shrek the Third,5,24 June 2007,Hardly Magic,"In 2004, three years after Shrek graced out screen, we were given its sequel, Shrek 2. Now this movie split audiences down the centre, some people loved it, others hated it and decided they no longer liked Shrek whatsoever. Others, like me admittedly, preferred Shrek 2 and found it be even funnier. The introduction of Puss in Boots was especially a nice touch and brought in even more pop culture references and a great villain in the form of the Fairy Godmother. So naturally I was pretty excited about Shrek the Third originally, then the trailers arrived. My initial reaction to the trailers was sheer horror, not only had I not laughed once in it, but also I was left feeling like I'd seen it all before in Shrek 2. It lacked originality, and that in itself horrified me. So I approached Shrek the Third with some caution, trying to prepare myself for a disappointment. And unfortunately that's exactly what Shrek the Third is, a disappointment. A well made, gorgeous looking and occasionally funny disappointment. Its certainly not the worst animated movie I have ever seen, but its hardly up to the standard of the original. I suppose my biggest moan with the movie is it never seems that funny, it has the occasional funny moment in it, and a lot of the movie has potential, but it never reaches this potential. It seems to be almost holding back, a lot of people complained about the pop culture references in the second part, but come on I'd like something a bit more than what we get here.Well lets start off with the characters and cast then. Mike Myers is as good as he can be in the role as Shrek, admittedly this was the first movie I truly appreciated the character. Shrek has always seemed bland to me, but likable. Here I felt he had his moments, and since he really is the main focus of the storyline here, and not really so much the supporting characters, I felt that this was more Shrek's journey. This is a good thing for the movie as it gave us time to appreciate how good the character actually is, albeit still being a bit unfunny at times. Cameron Diaz does her usual routine as Fiona, this isn't bad at all, and she has her moments, especially a well written Baby Shower sequence with Snow White, Cinderella etc. Eddie Murphy and Antonio Banderas however seem to have been given the short straw in this movie. They're the best things in Shrek 2, so naturally you'd assume the director would shove them in our face as often as possible. No, instead the director sidelines them and gives them nothing to do, a shame as they show flashes of brilliance, yet they're not in it enough for us to notice it. This is the movies ultimate flaw, as audiences go mostly to see the pair, even their obligatory dance routine seems half hearted with them. The supporting cast are all brilliant again, in fact a lot of the supporting cast are the best. John Cleese makes the most of his limited screen time, Eric Idle is an ingenious addition to the cast as the eccentric Merlin, and surprisingly Justin Timberlake actually works as Arthur, despite him not being very funny.The comedy of the movie is where its flaws are most prominent. The movie starts off on a high note, in fact for the first half hour I was quite a happy person indeed. The frog kings last croak is absolutely hilarious and undoubtedly the best thing in the movie, the funeral that flows is almost as funny, especially to the accompaniment of a frog choir singing ""Live and Let Die."" Then the movie sort of flounders when we reach Arthur's high school. Of course meeting Lancelot and Guinevere is a nice touch, and gives us some smiles. But popular girls speaking in an old language in their usual uncaring tone just doesn't work at all. Matters aren't helped as that scene sort of drags on and on. The scenes back in Far Far Away are much better as it shows some great characters with more screen time. I appreciated the villains in this movie, they had some pretty good moments, especially the trees near the end, that got a big laugh out of the audience. The movie just sort of filters out by the overly-sentimental ending. Its humour is always in the background, but never reaches its pinnacle like the others did. I enjoyed the movie, but can't say I loved it like the other two.The animation on the other hand is beautiful, absolutely beautiful. The landscapes are very well done and are thing of beauty to behold, the characters look realistic now, and at times you actually forget you're watching a cartoon! The storyline here as well is actually a bit better than Shrek 2's. I liked the storyline here and motives here a lot more, I also found the moral to be just that tiniest bit better than Shrek 2's. In fact this movie had the potential to be a bit better than the previous two, it just loses out with a lack of humour and by wasting the two best characters! Also the loss of the Fairy Godmother is noticeable.Overall Shrek the Third will please the kids, and huge fans of the series will lap it up. But its definitely a flawed movie with so much unfulfilled potential. I'd recommend seeing it, and perhaps a second viewing might be required to get the most out of it. But at the moment its just another sequel this summer that disappoints. Not quite as awful as Spiderman 3, at least I was never bored here, but its still a far cry short of the Summers greats such as Pirates of the Caribbean and Ocean's Thirteen."
235,Shrek the Third,2,18 June 2007,Not Half As Good As Shrek 1 and 2,"shrek 1 and 2 were my favorite shrek movies, shrek the third was not that good, not much adventure in it, i thought it would be a really great movie but instead wasn't half as good as shrek 1 and 2, i was really looking forward to it as well, the new characters in the movie were really great and all but again needed more adventure to the movie, thats the reason why i watch the shrek movies too is because of the great adventures thats in the movies and the great characters and because mike meyer and cameron diaz are one of my favorite actors. But i must admit the rest of the movie was OK, i laughed at some parts, but yeah"
236,Shrek the Third,7,18 June 2007,Where is that Shrek?????,"I saw Shrek the third yesterday will a full cinema in the father's day in Mexico city. I was very exciting about this film because the others two are great. First with the cinema full is very hard to find ticket and also to find a parking lot but well is Shrek 3 i was thinking.Finally i saw it and well what the F*ck? Where is that Shrek of the first film, yes the ogre, the arrogant, the malice, the one that live always angry in his marsh and the one that do anything just for his own interests. Also in the second film is that Shrek, a little less but still the film is very good.Other thing that i don't like is the short during of the film, only like 1 hour and 20 minutes.I put 7/10 just because the puss in the boots and the donkey, yes this characters are still strong and with great gags.......the puss in the boots is maybe the best character of the second and definitely of the third. Othe good aspect is that Antonio Banderas put his voice into the original version and into the Mexican version because the voices in the Mexican version are just crap. Finally i have to say that in the next film please put the original director back for the good of the film and for the good of the director because he do a crap film: Narnia.Well better don't do Shrek 4 because now Shrek is Father!!!!!!!!!!!!!!!"
237,Shrek the Third,6,15 June 2007,It's fun but it's very far away of the first two films.Disappointing,"In 2001,the film Shrek surprised kids and adults(I'm included in the adults' list) with a great animation,its subversive humor and its constant and brilliant jeer to the clichés of the fairy-tales.By my point of view,the film was brilliant.In 2004,the sequel of that film came and it managed to do something difficult:being very near to the level of quality from the first part.I had a lot of expectations with Shrek the Third,but the film really disappointed me.It is fun but it lost the charm and a big part of the humor the first two films have.The weakest point of Shrek the Third is the screenplay which is predictable and too obvious.The movie is always near to loose the control because of the absence of cohesion in the script.The humor makes the movie better,but I could not find the humor I found in the first two films.Some jokes did not make me laugh and the other part of them made me laugh,but it's a predictable humor.But the film has some good elements:like I said before,it's fun and the chemistry between Shrek,Donkey and Puss in Boots is very good.Also,Fiona's friends are a good addition to the story.The animation is spectacular.The images are very realistic and it's easy to note there was a hard work in here.Shrek the Third is fun and funny...but it's very far away of the first two films.And,because of that,I'm disappointed with this movie."
238,Shrek the Third,,14 June 2007,shrek the third soundtrack,"Who can help me with the title of the song /name of the artist(s) which plays in the moment when Shrek gets arrested by Prince Charming's guards(1h.02 min of the movie) :) 1000000x A very enjoyable collection of tunes are assembled for this third Shrek film. The standout track has to be ""Immigrant Song"" by the mighty Led Zeppelin. For a band whose popularity, influence, and record sales are matched only by The Beatles, Led Zeppelin rarely allow their music to be used commercially. I'm very pleased that in this case they did. As for the rest of the disc, there's not a single clunker to be found in this eclectic group. I love both prior Shrek soundtracks, but this one is superior."
239,Shrek the Third,8,14 June 2007,Pretty good!,"I liked it, though I did not think it was as funny as Shrek 2. The plot is great, especially the quest to find Arthur and Fiona's pregnancy! Yay! Ogre babies! Anything with Puss in Boots and Donkey in is great. I loved how the plots were played out and I think that the creators are still as good as always at hiding subtle jokes throughout the movie. Seeing it in the theater is really the best way to see it so if you can, go see it! We went to go see it as a beginning of summer celebration. My mom was wondering, ""Will there be any more Shreks?"" I don't know that, but I'm hoping that maybe they will be more. But if there are more, I hope they get better as they go along. I definitely think that was the case in the Lord of The Rings trilogy, the Star Wars prequel trilogy, and the Harry Potter movies. (At least that's my opinion.)What do you think? Well, I just wanted to say I really enjoyed Shrek the Third."
240,Shrek the Third,9,11 June 2007,Brilliant stuff,"When the King of Far Far Away is about to die it becomes clear that an heir to the throne must be found. Shrek and Fiona are in Far Far Away but Shrek doesn't feel much for the throne. So, the search is on for another heir.Shrek The Third picks up where Shrek 2 left of. Everyone is back in action and ready to roll from the first minute. And that's why this film works out so well - all players are right in their places in their specific roles and there is more than enough of a story to tell to keep things going for the full length of the film. Add to that the animations for this one that are a lot better than the ones used in the first film and it can't be much of a surprise that this third part is better than the first part and better than the second part.For the rest it brings just what is to be expected: a lot of dark and cynical views on fairy tales and a good lot of one like jokes that are somehow connected by the mad adventures to the many figures that run around through the film. So, all in all, a very worthy third party to the series. Looking forward to part IV.9 out of 10 Ogre Kings"
241,Shrek the Third,4,10 June 2007,"Shrek 3 ""little bit yucky, but a bit good"" words of my 4 yr old","My 4 yr old sons words and review of this movie are as follows:""The frog died, and because the yucky man was trying to kill Shrek. And the pigs were trying to fight the yucky guy which was really funny.""Now I watched this movie with my children and to be honest they weren't that impressed they preferred to watch Shrek 2, go figure. I myself was of the same mind as my children, wasn't bad and wasn't great sort of hanging out in the middle there.What I wasn't impressed with however is this movies blatant use of sexual innuendo, passed off as jokes and gags. What demographic are the writers aiming at, there are a few areas in the movie where i was just thinking ""What The?"""
242,Shrek the Third,4,6 June 2007,Skippadoodle,"This film was made for no other reason than commerce and a guaranteed payday for everyone involved. Considering the content emotional state of its protagonists there was little place to take both the story and its passe post-modern ironic jabs at pop and Disney culture. Murphy's voice is only an exploited extension of his hilarious work as the Klump family in 'The Nutty Professor.' Banderas's charm as 'Puss' is negated by monotonous character jokes as well as a poor second-act twist that makes the film increasingly grating. The plot hinges on 'Arthur' and Timberlake imbues him with a whiny, effete personality that is less than winning. He also appears incapable of reciting his dialogue with any double-entendres or meanings as everything sounds like he's reading from a kids book to a five year old audience. The film's saving grace continues to be the wonders that the film's limitless budget can provide to an expressive animated universe. There's no real urgent ambition here, just an opportunity for viewers to reconnect with old ""friends."""
