,title,stars,date,r_title,text
92,Shrek Forever After,,23 May 2014,Shrek Forever After,"Shrek Forever After (advertised as Shrek: The Final Chapter or Shrek 4) is a 2010 American 3D computer-animated fantasy comedy film, and the fourth and final installment in the Shrek series, produced by DreamWorks Animation. The film was released by Paramount Pictures in cinemas on May 20, 2010 in Russia and on May 21, 2010 in the United States. It was also released in 3D and IMAX 3D formats.Although the film received mixed reviews from critics and opened lower than expected, it remained as the #1 film in the United States and Canada for three consecutive weeks and has grossed a worldwide total of over $752 million, making it a commercial success. Additionally, Shrek Forever After is DreamWorks Animation's second highest-grossing film at the foreign box office surpassed only by Madagascar 3: Europe's Most Wanted.[3] It is also the second highest grossing animated film of 2010, behind Toy Story 3."
93,Shrek Forever After,3,20 December 2012,An excuse for blockbuster,"We all hate comparing things , but when a worldwide famous franchise as ""SHREK"" appears on your nearest theater , not putting the previous Dreamworks efforts into question is probably a daunting task. The first two ones were awe-inspiring and a milestone into animation films.The voice acting was superb , the characters were deep and the audience could relate with them , the OST was excellent disregarding whatever your musical taste is , and the plot was indeed an Oscar-worthy script. With the third one all those elements seemed to be there , but diminished and somewhat blurred and somehow far from the original idea.In Shrek Forever After , all those elements that made the franchise a world-class filmi are totally gone.Not a single trace of them. Shrek has turned into a dumbed-down story with clichés overused into Hollywood filmi.Putting aside the fact that Shrek 4 is carrying a heavy weight on the shoulders , on it's own it's not even an OK film , simply a forgettable summer-carry-along-your-kids blockbuster. Sure , the animation is better than ever and surpasses the other 3 filmi , but animation relies on technology and it improves and becomes better with time so the visual aspect is not a positive thing.Shame on you Dreamworks , shame on you.If you enjoyed the first 2 filmi and liked the third: A)If your expectations are low :give it a try B)If your expectations are modest:forget this one. C)If your expectations are high :forget this one."
94,Shrek Forever After,6,14 December 2011,Shrek Forever After (2010),"Usually an alternative reality plot is just a gimmick used by lazy writers. Imagine if Puss was fat, if Shrek had never been born etc. Such ideas leave limitless ideas for writers, and they don't even have to try. Shrek has always leaned toward the obvious ""what if"" scenarios. Part 2 saw Shrek and DOnkey become handsome, part 3 had Donkey and Puss trade bodies, and so on. Now an entire film is based around this idea. It shouldn't work, but it kind of does. This is certainly a step up from 3. There are more laugh out loud moments, and I even got 3 big belly laughs. The action scenes are exciting, but too concerned with 3-D, making it distracting. Like the other Shrek films before it, it has too many songs playing over the scenes. Probably hoping to shift as many copies as the fantastic Shrek 2 soundtrack. The film starts off with some great examples of Shrek's growing frustration. It's easy to see why Shrek wants his life back to normal. The quick cut montage, followed by the birthday party from hell, leads us into a believable situation where Shrek signs the deal. We also have a wonderful villain, voiced perfectly by Dohrn. This wont gain any new fans. Nor is it a satisfactory end to the franchise. What it is, is an enjoyable spin on the characters with some nice jokes."
95,Shrek Forever After,,8 August 2011,A nice end to the franchise...,"I must admit that I have a bit of a soft spot for the Shrek films. I don't know what it is; I guess I just like the brand of humour in them and (for the most part) the likable characters. The third one (I felt) was a bit of a mess, but they appear to have got it nearer the mark for the final instalment until they decide to make some more, that is. I will give you my thoughts after this brief summary sponsored by 'Pete's Potions', available at all major 'Fairy Godmother' outlets nationwide.Shrek is finding it hard to cope with the routine of everyday life, the children, the visitors, the tour bus it's all getting on top of him. This all comes to a head at the kids' first birthday party where he has a big row with Fiona and storms out. He meets Rumpelstiltskin on the road and they start talking about their woes. Not knowing Rumpelstiltskin has an ulterior motive, Shrek signs a contract that sees him projected into an alternate reality, one in which he had never existed until now. He finds that nobody knows him, not Donkey, not Puss in Boots not even Fiona! It then dawns on Shrek that Rumpelstiltskin has conned him. Fortunately there's a get-out clause in the contract, but can he fulfil it before sunrise? Of course, I'm not going to tell you here or them Spoiler Police will have me back on the farm working for that no good Old MacDonald.Favourite Character  Puss in Boots (made me laugh) The animation is just what we've come to expect in these films, and, as usual, it is excellent. Just for reference, I stuck to my principles and watch it in 2D. As usual, some great tunes, particularly at the end, but generally, a decent score. All the usual voice talent was on show, and the all did a good job. So honourable mentions go to; Mike Myers as Shrek, Eddie Murphy as Donkey, Cameron Diaz as Princess Fiona and Antonio Banderas as Puss in Boots. I should also give a special mention for Walt Dohrn who did the voices for Rumpelstiltskin, Priest and Krekraw Ogre.Favourite Quote  Donkey: ""Wow, that's a big kitty!... Can we keep him?"" I'm quite glad this franchise has reached an end, not because I think they're no good any more, but I can see a day when that will be the case. As I've already said, I really get the humour in these films and I wish there were more comedies made in a similar vein. I half expected this one to be awful, if I'm honest, after the let's say less than warm reception it got from the critics. It was a pleasant surprise to find it wasn't all that bad. Yes, the Rumpelstiltskin character needed more development, but I didn't really mind. It entertained me for ninety minutes and that's all you can ask Recommended.My Score: 6.5/10.IMDb Score: 6.6/10 (30,431 votes when this review was written).Rotten Tomatoes Score: 57/100 (187 reviews counted when this review was written)."
96,Shrek Forever After,,20 July 2011,"Better than the Third, but...","Don't get me wrong: I love the first two. The Jokes were hilarious, the plot was well formed and written, and the voice actors well chosen. But the Fourth installment in the Shrek series echos the third: The Jokes fall flat, the actors are clearly tired of doing the series, and the plot-if any-is boring and tasteless. It's understandable why-The twist on fairytale movies is done. Every single story has been covered, and all of the writers have been using the same format: Villain comes back for revenge, initial hero either defeats them or fizzles out and the supporting character fixes everything. I'm not kidding, they've been using the same format since the genre was invented. Shrek, Hoodwinked, The Princess Diaries, Anastasia, Happily N'Ever After-they all have the same concept. And while it was great in its early days, it's clearly fallen short for the audience. I gotta eat some olives. Athena2264 OUT."
97,Shrek Forever After,8,7 July 2011,definite uptick in quality,"As ""Shrek Forever After"" opens, the warmhearted ogre is suffering through a bit of a midlife crisis. Having been firmly ensconced in marital and domestic bliss for quite some time now, Shrek suddenly finds himself pining for the days when he could be a real, full-time ogre, roaming the countryside and terrorizing the general populace - instead of changing diapers, pushing strollers, and signing autographs for fans who remember those long-gone glory days when he could still strike fear into the hearts of men.In the ""be careful what you wish for/you don't know what you've got till it's gone"" scenario that Josh Klausner and Darren Lemke have concocted for this fourth entry in the series, Shrek (Mike Myers) allows himself to be tricked into essentially signing his life away to the dastardly Rumpelstiltskin (the excellent Walt Dohrn) in exchange for a chance to once again become a full-fledged, undomesticated ogre for a day. We then get a new spin on ""It's a Wonderful Life,"" as Shrek learns what the world would have been like had he never been born. He also has to get Fiona (Cameron Diaz)  the beautiful princess by day/ugly ogre by night who, in this alternate universe, is now the leader of a band of freedom-fighting ogres  to fall in love with him all over again.Though a definite improvement over the drab and disappointing ""Shrek the Third"" from 2007, ""Shrek Forever After,"" directed by Mike Mitchell, never quite achieves the level of cleverness and wit that the first two installments did  which is a high bar indeed for anyone in this business. Still, the mix of Fractured Fairy Tale revisionism, pop culture references and recognizable pop tunes remains a winning one for the most part, and there is just enough sentiment to lift our spirits without stranding us in a puddle of goo. Plus, all the great sidekicks are back, including Donkey (Eddie Murphy), Puss In Boots (Antonio Banderas), and Cookie (Craig Robinson), and the voice work and animation are, as always, first-rate. In fact the voice-over cast reads like a who's-who of well-known actors and performers: Julie Andrews, John Cleese, Jon Hamm (""Mad Men""), Jane Lynch (""Glee""), Kathy Griffin, Mary Kay Place, Meredith Vieira, Ryan Seacrest, Regis Philbin and Larry King. Not a bad little group that."
98,Shrek Forever After,,6 July 2011,Greenery.,"Basically ""It's a Wonderful Life"" for ""Shrek"" fans as our titled hero is tricked by Rumpelstiltskin to be erased from his reality and thus creating a weird and dark alternate reality. Talk about your mid-life crises. Can be looked upon as creative or down-right plagiarist, but overall an adequate continuation of the long-running series as ""Shrek Forever After"" matches the little intensity left by ""Shrek the Third"", but the first two of the series seem like distant memories now. The voice characterizations are still right on the money and the sight gags and one-liners are still strong enough to endear the film to even the harshest of legitimate critics. However, in the end many may wonder if this is the last theatrical gasp for our friend Shrek though. 4 stars out of 5."
99,Shrek Forever After,6,24 June 2011,This one was definitely better than the . . .,". . . third installment, but ""Shrek 2"" definitely remains the best of the four. At least, they took their time with ""Shrek Forever After"" to devise a pleasant twist on the tale of ""Rumpelstiltskin"" and incorporate that story into Shrek's and Fiona's. They didn't make very good use of Donkey this time around, however, which was unfortunate. Overall, it was good, as compared to the less than satisfying ""Shrek 3"", which suffered in large part from the creators rushing to capitalize on the masterful ""Shrek 2"" (which remains the best of the four). At least, the creators were able to end the story with a good one!"
100,Shrek Forever After,6,13 June 2011,doesn't really add anything to the story,"There was really no need to make this movie other than to make more money. It's not like it added anything to the Shrek story. Plus it wasn't as good and had a really short run time at well under 90 minutes. Nothing made me laugh in this, but I'm sure kids will still love it. This time, Shrek signs a deal with Rumpelstilskin to erase a day of his life so he can be a scary orge again. What he doesn't know is Rumpelstilskin has plans to take over Farawayland and be king. To do this, he must see that Shrek never saved Fiona from the dragon. So, Shrek is taken to an alternate world where he never met Fiona and must get her to fall in love again or disappear forever. Quite a few of the other characters make appearances, but Donkey is the only one given anything to do.Final Verdict: a story works good the first time, but by the third movie it's old. skip it."
101,Shrek Forever After,6,21 May 2011,A massive improvement on Shrek the Third,"When the original Shrek film came out in 2001 it was seen as a revolution, an animated film that looked pretty realistic (realistic in the context a fairy tale setting), a film that was funny, action packed, able to appeal to adults as well as children and most importantly, challenge Pixar's domination when making CGI animated films. But slowly Dreamworks and the Shrek series itself became a shadow of its former self, whilst Shrek 2 was just as good as Shrek but they also made slowly made weaker films like Flushed Away, Shark Tale, Bee Movie and Shrek the Third. But Shrek Forever After is better then Shrek the Third.Starting with a prologue the magical conman Rumpelstilskin (Walt Dohrn) very nearly got his hands on the crown of Far Far Away, when Shrek (Mike Myers) saves Princess Fiona (Cameron Diaz) and ends up ruining Rumpelstiltskin. Years later it seems that Shrek and Fiona are living a perfect live with their children in the swamp but slowly Shrek gets bore of the routine and being a celebrity. He longs for the glories days of being a true ogre, feared and ends up making a deal with Rumpelstilskin. But of course Rumpelstilskin tricks our hero into a world where he is not born, that Rumpelstilskin is king with witches as his enforcers and ogres are hunted. None of Shrek's friends recognises him and Fiona is leading the resistance. There is only one way to break the curse, true love's kiss.The basic plot is the same as A Wonderful Life, a message about be careful of wish for and that the grass always seems greener on the other side. It is a story that has been done to death in both film and television, particularly in children's programs. But it also serves as a way to get round the fact that Shrek is meant to be a family man and should be content with his happily ever after.Whilst the plot is rudimentary Shrek Forever After is better then Shrek the Third. It is a faster paced film, the jokes are better and its most impressive feature is the action. Shrek has quite a few fights with the Witches who have some really good weapons, like the skull chains and the poison apple gas grenade (a little play on fairy tales, particularly Snow White). On of the keys to Shrek has been the pop-culture reference, but it went stupid by the third film with the medieval school. Likely Shrek Forever After tones it down a bit (since it has done everything possible) with the only major twists being the witches' nightclub and a few film reference, like the Gingerbread Man in a Gladiator parody. The best jokes involve my favourite character Puss in Boots, who turned into a flabby tabby and pampered cat, as he declined from a deadly assassin to a house pet. He has the best lines and the physical humour. You got to love the little guy. Some of the comedy did not work, like the ogre dancing and Shrek's attempts to woo Fiona. But at least the film was more focused then Shrek the Third and Rumpelstilskin is a better villain then Prince Charming, but still not as good or interesting as the villains in the first two films.Like the previous films the animation is crisp, looks realistic and great following movements. Director Mike Mitchell is a live action director, but he adapted to animation and provided family friendly action scenes. There was some dodgy moments, like a witch prostitute (because that what children's films need, sex workers). Mitchell ensured that there was a emotional heart to the film, Shrek trying to woo back Fiona, something lacking in the third film.Shrek Forever After is meant to be the last film of series, but I don't believe it. We all know how Hollywood works, keep making films until the money runs dry. We already got a Puss in Boots spin-off on the way."
102,Shrek Forever After,6,22 April 2011,Shrek Forever After,"Shrek 4, or, the It's a Wonderful Life episode of the series, is the worst of the series.Don't get me wrong, it's entertaining, it's fun, but it's stupid. I may be the only one that thinks Shrek the Third is better.The first 85 minutes are good (7/10) but after that, it just got crazy. It was the first time I really notice Shrek lost it's ways. I mean in the beginning, Shrek was original, spoofing fairy tales, it was funny! Now, Rumpelstiltskin is a regular character. Yeah.It's not that it's bad, it's just sad. The fact that Shrek has lowered itself so much. Crazy."
103,Shrek Forever After,6,22 March 2011,Ogre forever after,"Its relief after Shrek third. It has good fairy tale story all about true love kiss. I like the way they used magical things in the story. It has good humor if we compare to Shrek Third it is better than it.Shrek bored with his life ends up in the treachery magical contact which makes realize his mistake and importance of family , love and friends He has to once again have to kiss Fiona and there kiss will broke the contact but he has one night to do that and Fiona no longer remembers him, he have to make her realize about them.But still it is nowhere near to first two installment of the series. But movie has good parts and better moment than third."
104,Shrek Forever After,7,13 February 2011,A nice finish to the Shrek Movie collection.,"Unlike the fiasco of Shrek the Third, this one actually went back to its roots.The plot wasn't too bad either, as it was about an alternate universe of Shrek's world after he made an ill advised deal with Rumpelstiltskin. The ogre resistance army was a nice touch, as well as showing Fiona as an Ogre warrior.It didn't have the epic feeling of Shrek 2, but I did enjoy this one a lot more than its previous installment. The writers of this movie actually tried this time, which made me happy."
105,Shrek Forever After,,28 January 2011,recycling,"They had to take this tale a few steps back in order to make a 4th version of it. The first one sounded fresh in how it reused popular cosmologies borrowed from the sweet corner of children's oriented stories. The second one floated over that and played an interesting game of twisted self-reference(s). That was the best. The comedy was in the out references and how the filmmakers played with them. The form itself was funny, more than the jokes or the characters.Now this 4th version needs to make a story about how the romantic story involving the ogre and the princess has to happen again. So the story is literally reset to the very start, before Shrek knew Fiona, or the donkey, or before the cat was a recognizable character.I admit the device works to revive the freshness of the first film, after the disaster of the third one. If you play along and want to get nostalgic about that one, made 10 years ago, you can enter the game and have a few laughs. The cleverness of the device allows you to do that. But there's not much happening here, apart from that.The characters are as tired by now as poor Shrek at the beginning of the film when he punches the table.My opinion: 2/5http://www.7eyes.wordpress.com"
106,Shrek Forever After,7,27 January 2011,Almost perfect way to end the Shrek series...,"Dreamworks style.Shrek 1 was perfect. Beyond a doubt. Funny, original, unique, emotion, and so on. The plot was perfect, the characters were awesome, the love and the humor tied in perfectly. A first (my opinion) for Dreamworks.Then came Shrek 2. Even better. It continued the story, and still had a ton of uniqueness as well as keeping the original feel of the idea. The humor was very well done, and the love was just as great. I dare say it almost was better than the first one! Shrek 3 comes and you can see Dreamworks trying a bit too hard to keep the series going. You can start to see the new characters introduced starting to loose their originality. The original characters don't improve too much, they just keep learning the same life lesson. The emotions start to lessen.Shrek 4 finally comes and attempts to end the series. This was in competition with Toy Story 3. To be honest, Toy Story wins the ""finish the series award"" but if I were to focus on just Dreamworks, then it's not to bad.The new characters, to me, come out of no where. They lack the originality, they still have humor but they don't really seem ""scary"". Puss in boots instantly becomes a classic to the story. But they start to loose the characters at that point. I mean, the main evil character in Shrek 4 isn't that much of an addition.But anyway, it was an okay way to end, it could have been better, but it could have been worse.Rated 7/10"
107,Shrek Forever After,6,22 January 2011,3D Review: I hope this is the final chapter,"**1/2 out of (****)Going into the 2001 family adventure extravaganza known as ""Shrek"", I was quite skeptical despite its rave critical reception. After coming out of the theater, I had such a blast and had even a greater time watching it on Blu-ray 3D. ""Shrek 2"" was three fourths as good as its predecessor, which was good enough. It still retained ""Shrek""'s charm, witty humor, and enjoyment factor. ""Shrek the third"", or should I say ""Shrek the turd"", was like a bullet to the chest. It wasn't funny, it wasn't entertaining, and it was just uninteresting. The Good News: Forever After is a refresher over the third installment. The Bad News: It kind of stinks.First and foremost, the acting. Strangely, I did not care about any of the characters except Donkey. It seems like everyone was so angry all the time. They just weren't fun. At all. As for the script, I thought it was very uninspired. It was like a leftover script from ""Shrek 2"". Furthermore, the biggest flaw of this movie is that it's just not fun. The same problem its predecessor shared, ""Shrek the third"". There's just no charm, no fun. It's just a very average family adventure flick that just so happens to top its last installment. Anything good? Well... the 3D is solid. The depth is amazing, there's a sufficient amount of gimmicks, and overall it adds to the experience. Speaking of enhancing the experience, visually, this is the best Shrek movie. There's a plethora of color, especially at the end, and the atmosphere is just so rich. It doesn't even feel like a Shrek movie. And, I did like the message. There are some animated movies that are melodramatic (intentionally too), and lay on morals very thick and syrupy. This film isn't one of them.All in all, I really tried to like this movie... but I just didn't. While it's not a chore to sit through, I could've done something more productive. I just hope it's really the final chapter. While it's not a disgrace to the franchise, it's not a highlight either. It seems like these sequels get more uninteresting and less involving. Actually, I might think that my ""6"" rating is a little generous. This isn't a bad movie, it just could've been better given its potential."
108,Shrek Forever After,4,14 January 2011,Wow - was that a huge disappointment,"I so loved ""Shrek - the original"" and even scored it 10/10. The original had everything a movie needed to have, but I never anticipated that the last installment would be nothing more than a very weak battle between ogres and witches. Shrek Forever After doesn't have any good jokes or sense of humor in it, let alone a storyline, or script! I'm glad I only rented it from the video-store for $3 and didn't buy it! This makes me realize even more how I dislike cash-cow sequels. The worst thing of all they've already announced 2011 as the year of sequels and superhero movies. Jesus Christ - how low can we go. From a positive side, I do like the idea of alternative realities, as it matches with some of the multi-verse theories that go around in the world of physics, but putting those in Shrek? It all seems a bit too far from being a fun movie to me!"
109,Shrek Forever After,3,14 January 2011,No Coherent Plot,"This film lacks a major plot outline. The Shrek franchise is known for making brilliant comedy films, but this one lacked sparkle and magic and originality. The plot focused too much on the first film, and didn't focus enough making an original plot with comedy. It was a bore to watch and genuinely shouldn't be allowed to go ahead with a 5th.The film seems to focus on using the script and storyline of the first film and rewriting it slightly. It was a short, boring, badly acted, badly written and badly everything film. The only thing giving it a little magic was the experience of the people making it, as this was the 4th one. To improve- this film should focus on getting back to its roots and working out how to reconnect with the audience I am afraid, as a Shrek fan, I reluctantly give this a 3."
