,title,stars,date,r_title,text
124,Shrek Forever After,4,18 June 2010,Not bad definitely better then the third one!,"i liked it a lot better then the third instalment of this series thats for sure, however even though i have heard that there is no need to worry about a fourth chapter to this because the creators etc, are done. This chapter had at least a mildly entertaining storyline that has Shrek at a crossroads in his life...married children wife,donkey and the rest of his clan however he dwells on the fact of the days when he lived alone in his swamp and frightened everyone. After a breakdown he ventures off on a stroll to cool down accidentally bumping into Rumpelstiltskin on the way, Rumpelstiltskin befriends him and offers him a way to go an be a scary ogre all he has to do is give him a day of his life he cant remember. What ends up happening is he gets thrown back in time having to get Fiona to fall in love with him all over. Can he win everyone back ??? Moral of the story is be careful what you wish for..you just might get it. We didn't have the chance to see this in 3d format however it was enjoyable all the same. All these chapters of the Shrek story are missing one huge element that the first instalment contained... comedy."
125,Shrek Forever After,6,18 June 2010,"Well, it's better than part 3.","SHREK FOREVER AFTER or SHREK THE FINAL CHAPTER (or whatever you want to call it) is better than SHREK THE THIRD but that's not saying much.Seems Shrek is sick of the new life that he has and wants to go back to his old life where people are still afraid of Ogres and he doesn't have to deal with the baggage that comes with being a parent. Hey, if that is the case, you should of wrapped your Ogre dong up with an Ogre condom and your problem should have been solved.Anyway, Shrek makes a deal with Rumplestiltskin (an annoying voice if I ever did hear one) and suddenly Shrek is swept back to a day when people ARE still afraid of Ogres and he doesn't have the responsibilities of dealing with his offspring. Plus, he no longer has Fiona has his devoted wife. I say devoted cause she made the choice to stay an ugly Ogre instead of the beautiful Princess that she ""sorta"" was cause she knew that she loved Shrek and that she would pretty much do anything for him. That shows devotion. For Shrek to make a deal with Rumple-dumbass so that he could live his old, so called ""normal"" life for one day again just shows ignorance on his part.So, like I have to say it, Shrek realizes that he wants the life back that he had with his wife and his kids and his old friend Donkey and all those other asses. Only thing is, in order for Shrek to get the life back that he had, he must break the deal he had with Rumple-foreskin by kissing Fiona cause in the fine print clause on the deal he made with you-figure-it-out it says something about ""True Loves Kiss' or something along those lines. It's only ""true love"" if Fiona actually loves him. Of course other things happen along the way and of course Fiona does love him by the end of the movie. I don't necessarily consider that a spoiler cause if your reading this and you couldn't figure that out than, well, your an idiot. lol.Anyway, once again, this movie is better than the 3rd one but, like I said, that's not saying much. I really do hope Dreamworks ends the Shrek franchise with this movie. I guess we'll have to wait and see."
126,Shrek Forever After,5,17 June 2010,Shrek and co feel stale today.,"This fourth instalment tries hard to bring something fresh to the franchise, however Shrek and co just feel stale today, nine years on from their glorious introduction. Donkey has gone from causing belly laughs and sprouting quotable one-liners to being annoying and repetitive; not overly great for the character which has always been the true drawcard for the series. Though it is the big green man himself who has become the most tiresome; his constant whinging and heavy Scottish accent the source for serious boredom. Especially since this sequel has amped up the seriousness and soppiness, majority of which comes from Shrek. There are a few supporting players which snare a laugh here and there, Puss-in-Boots and Butter Pants  a manly looking child with a memorable voice  being two worth mentioning.Fortunately the in-charge Mitchell has a solid handle on the action sequences. There are a number of set pieces  Shrek and Fiona's climactic escape from Rumpelstiltskin's clutches is a highlight  that are exciting and enjoyable, but they act like a double-edged sword and also serve to emphasize how dull the slower, talkative scenes really are. If only the cast and crew could inject the familiar characters and run-of-the-mill story with the same amount of energy and enthusiasm, perhaps Shrek Forever After could have been a more fitting closure.The one (and only) thing improved upon since the first movie  the animation  is delightful to look at mind you. The picture is crystal-clear and the third dimension has been utilised properly. There are a handful of instances where the 'coming-at-you' gimmickry rears its ugly head, which the kiddies don't seem to mind, however for the most part Mitchell grasps the true effectiveness of 3D quite well and adds depth to the visuals which in turn allows his on screen universe to expand.Dreamworks has said for a long time that this will be Shrek's last adventure, if this is the best they can come up with for the famous ogre and his friends then let's hope they stick to their guns.2.5 out of 5 (1 - Rubbish, 2 - Ordinary, 3 - Good, 4 - Excellent, 5 - Classic)"
127,Shrek Forever After,9,19 May 2010,this movie is so far far away from being as bad as the third,"i saw shrek forever after at a private screening in my hometown and i was so happy to see some of that more mature humor that is in the first 2 movies, shrek the third was your normal bull,boring,kid flick.the 3d was amazing the story was OK but a lot of TV shows and other movies have use the make a wish and regret it later plot.for people who are mike myers fans you will love this movie he has a very good talent for voice over work you can tell he enjoys it now for Cameron diaz i don't know in the first shrek she played her part wonderfully in this one it seems she rushes her lines and she fakes her emotions i know she is a acter and that's her job but she is much more believable in the first shrek.now what can i say about Eddie Murphy he is the best person,actor,comedian,to play the role as donkey, donkey's character is fast talking, cocky, witty, funny, and at times serious just like Eddie Murphy .and last but not least puss in boots played by Antonio banderas in my opinion puss stills some of the spotlight from donkey witch is perfect because they incorporate that into the movie with donkey and puss always arguing and competing for attention from shrek.in short if you are into fairy tales, love stories,adventure,and having a good time than i would recommend go see this movie whether in 2d or 3d this is a wonderful movie."
128,Shrek Forever After,7,20 May 2010,Waaay better than the third Shrek...,"To be honest, I was expecting to watch something that would make me laugh like I did in the first two parts of shrek hoping that dream works learned from their mistake after the epic failure of the third installment, but it still didn't reach their level of awesomeness, but you can say that shrek did it again....Partially.In general, the movie is cool, it's funny and entertaining, it has its hilarious moments and the story is pretty much satisfying, Way better than the third shrek if that's what you want to hear.So in the end, I recommend you just go and watch it with your popcorn and drinks and prepare to enjoy it enough but expect that much."
129,Shrek Forever After,8,23 May 2010,A Surprisingly Dark Finale for the Franchise,"Shrek is feeling over-domesticated in the fourth installment. He has lost his roar. It used to send villagers running away in terror. Now they run to him and ask him to sign their pitchforks and torches. To regain his ogre mojo, he strikes a deal with Rumpelstiltskin. The pact goes awry and Shrek must confront what life would be like in Far Far Away if he had never existed. That translates into Donkey being forced into cart-pulling duty, fat and lazy Puss in Boots trading his sword for a pink bow and the underhanded Rumpelstiltskin ruling the kingdom.It's official: Dreamworks has crap marketing when promoting their movies. As some of you might have noticed, the marketing for the final chapter of Shrek seemed lukewarm and tepid, to say the least. Fortunately, the film is anything but that. In fact, I have to say that SHREK 4 is a surprisingly dark finale for the franchise. SHREK 4 plays out like IT'S A WONDERFUL LIFE with Shrek being the protagonist. The main reason this film succeeds is because there is a strong story to be told, unlike part 3. The story plays out as straightforward as it could be, which works really well. There are no twists and turns and unnecessary subplots. This way, we feel more connected with Shrek and his goal.The heart, which was lacking in the last film, is back in here, which is more of a welcome. There are a lot of depressing and serious moments in here as well as some very moving scenes that will make some people cry. However, all is not somber. There are plenty of hilarious moments in here too, most of which are coming from Donkey and Puss in Boots, as well as some new ogre characters. Other new characters include Rumpelstiltskin, a fantastic and devilish villain, and the ingenious use of Pied Piper.I would also like to point out the fantastic soundtrack by Harry Gregson-Williams. He incorporates the previous themes in the series and made them much more personal and heartfelt than ever before. The use of the 3D is also put to good use, rather than have things pop out for every five minutes. Maybe the only complaint I had is that the climax battle is a bit weak, much like IRON MAN 2. While not as great as the first two, I much prefer this film to be the ending to the series than the disappointing third film. With a strong story, great characters, and a good moral, SHREK 4 may as well be the first great film of the summer."
130,Shrek Forever After,8,31 May 2010,Best Shrek yet,"This is the best ""Shrek"" movie since the first one and is easily the funniest of the lot. This time around the plot revolves around Shrek developing a mid-life crisis and making a deal with the devious Rumpelstiltskin (the villain of the piece) to have one day of his single life back, he gets his wish but loses the day he was born in exchange. The rest of the movie follows how Shrek tries to get everything back to the way it used to be.All the ingredients that have made this franchise so popular are retained- particularly the clever pop culture references and the sharp interplay between all the main characters. The soundtrack is also very well-chosen and some of the selections are used to hilarious effect. All in all this is a very funny film from beginning to end and a top choice if you are looking for a lighthearted night out. Highly recommended."
131,Shrek Forever After,7,21 May 2010,A More Mature Shrek - A Worthy Last Installment,"Our favorite ogre Shrek is back for its final installment, and this was presented in 3D. 3D is getting to be norm nowadays, it seemed already ordinary. There are only few scenes in this movie that the 3D actually inspired awe. Maybe watching in 2D would be enough, in retrospect.In Shrek Forever After, Shrek is getting bored with his routine family life and misses his terrorizing ogre days terribly. After his emotional breakdown during his triplet's birthday party, Shrek signs a deal with the devious and cunning Rumpelstiltskin to experience to become real ogre again for a day. However, in return, the contract makes Shrek lose more than he bargained for -- everyone he loves. To break the spell, Shrek to make Fiona fall in love with him all over again.The theme is definitely more mature. The scenes where Shrek was trying to reconnect with the warrior Fiona were actually heartwarming and charming. The lines towards the end about love and family were very nice and touching. Shrek's very last words were a most meaningful parting message to the dads and moms in the audience.Donkey and Puss were there to provide effective comic relief, as always. I did not really like the look of the main villain, Rumpelstiltskin, so that detracted from my total enjoyment. I thought their interpretation of the Pied Piper, however, was quite smart.I thought the Shrek franchise went the wrong direction with its insipid third movie. The first two were really animation classics in terms of comedy and action. This fourth one fortunately went back on track in the correct path. While not in the same caliber as the first two, this was certainly a very good last episode of the franchise."
132,Shrek Forever After,6,23 May 2010,"Lost its magic, but it will keep you entertained.","Shrek 4 might be the most heartwarming of all the Shrek films but the jokes were lessen, they add more dramas and love story. It's still good but not as great as the first and the second. The previous ones were masterpieces. Shrek 4 is not original unlike the first. I must say that it was more mature than the others but is that what you're really looking for in Shrek movies? I came to see some pretty good jokes. In addtion, some of the jokes were pretty similar to the previous ones. Its conflict was pretty boring unlike the smashing conflict of the 2nd. But it is absolutely better than the third but only because its story makes much more sense. Of course it isn't the worst movie ever, and not the worst Shrek films. Should you watch this in the theaters? My advice is wait for it to come out on DVD. You will not waste your time watching this, but you won't have a blast either."
133,Shrek Forever After,4,30 May 2010,"Dull, bland and forgettable, but not as bad as Shrek The Third","Shrek 1 & 2 were both masterpieces in their own right, and Shrek The Third was awful. Shrek Forever After is mediocre but now this series must come to an end. The new car smell of the series has worn off, and it just feels like they're doing the same thing over and over and over again. This is just disposable family entertainment meant for parents to spend $10 to take their children to it, and this movie is alright enough so that if the kids like it, the parents won't mind. All the old voices (Mike Myers, Eddie Murphy, Antonio Banderas, Cameron Diaz) return, along with new voices like Jane Lynch, Craig Robinson, Kathy Griffin, Kristen Schaal, Mary Kay Place, and scene stealing Walt Bohrn as Rumpelstiltskin, the mean, cynical man who cons Shrek into never being born. This is basically an animated, ogre-filled version of It's A Wonderful Life. That might of been a good idea if the execution were actually good, but it's dull, bland, and forgettable. The Pied Piper comes in as a character playing a bounty hunter role, and he's awesome, but the good outweighs the bad and unless you have kids begging you to see Shrek Forever After, then you'd be better off just skipping it."
134,Shrek Forever After,6,5 September 2010,'Shrek Forever After' is a glass half-empty,"In the 3-D (and stereoscopic) animated film, Shrek Forever After, Shrek, the green ogre, has become bored with the domesticated life of raising children with his wife, Princess Fiona, along with the fact that no one treats him with any fear or respect. One day, Shrek feels he has had it and makes a pact with Rumplestiltskin, a deal-making magician of sorts, to feel like a real ogre for a day. When he finds out he's been duped and sent to a twisted version of Far Far Away, where Rumplestiltskin is king, ogres are hunted, and Fiona doesn't know him, he sets to get his life back and reclaim his true love.This one is the fourth installment of the Shrek series. I haven't seen the third one, as I had heard many horrible things about it. I have seen the first two, which I've enjoyed immensely. First film offered a clever, humorous twist on fairy tales. Second goes farther with the twists by adding pop-culture references re-imagined in context of the fairy tales. Both were very inventive and full of energy and details. This version, unfortunately, feels like all of that has been reduced by half. In general fun and humor, it's straight-to-DVD quality, although you can't get the stereoscopic view. The jokes aren't as funny as it used to be. The details and environments also feel somewhat desolate this time around. The subtleties are gone.The stereoscopic 3-D aspect of the film feels like it's been tacked in there. The flying scenes inside the castle are kind of neat, but during most of the film, I didn't even notice that it was in 3-D. Don't expect anything as grand or beautiful or clever as How To Train Your Dragon.I suppose by the fourth film, it is inevitable that much of the joy of the first and second film will have been drained out. I assume the storytellers are running out of ideas when sequels revert to a time-travel idea (I'm reminded of Teenage Mutant Ninja Turtles 3: Turtles in Time) or a ""reboot"" of sorts. Yes, it's essentially a reboot because much of the film is an alternate timeline, and Shrek has to meet his friends all over again who don't recognize him. It's kind of like getting re-acquainted with Arnold Schwartzenegger's T-100 in Terminator 3. It also doesn't help that the plot concept has been done before, such as in It's a Wonderful Life and Mr. Destiny. The plot progression is essentially by-the-numbers, and so is a good chunk of the humor. It never feels quite organic. There is more slapstick than jokes. Sadly, in my theater, I couldn't hear any kids laughing at any of the jokes, which wasn't a good sign.However, there are some good moments in the film. Despite the overused plot, Shrek is still a likable character. Eddie Murphy's Donkey is still around. Conrad Vernon's Rumplestiltskin is a mean yet somewhat dark character, reminding me of John Lithgow's Lord Farquaadalmost. The Pied Piper as a baddie is an ingenious ideahow I wished the film centered more on this guy! A scene involving Rumplestiltskin's ""half-full"" glass of water is also excellent. I even liked the fact that Shrek goes through something like a midlife crisis. I only wished it was handled in a way that wasn't so familiar.Overall, it's not a bad film. It's just doesn't live up to the potential set by the previous films I saw. If there was no Shrek 1 and 2, it may've been considered a pretty decent film--of course, it also means there shouldn't be other good 3-D animations to compete with. Nevertheless, friends have told me this installment is still miles better than the third one. I guess I won't be seeing the third one for sure. I give Shrek Forever After ** out of **** stars.You can also follow my more recent reviews on twitter.com/d_art"
135,Shrek Forever After,6,20 July 2010,It's... another Shrek movie.,"I wouldn't say this was a bad movie. That would be a lie. I did enjoy this movie.The major problem with this movie was that it just was another Shrek movie. Similar plot line, same jokes as the other ones, same resolution.As a movie, it was alright, but it failed to stand out as anything. It didn't do anything to make it stand out from the rest of Shrek movies, or in movies at all. It was ""Just another Shrek Movie."" That is how I felt about it. It was an interesting concept, adding to Shrek's life story, but by the end of the movie, I thought to myself ""Well, at least I didn't pay to see this.""So, I would say it's worth a watch, but don't expect anything exceptional."
136,Shrek Forever After,5,3 July 2010,Depressing end to a creative series,"It's unfortunate that the Shrek series ends here. Not because it should continue, but because this film could've benefited from another year in script development and actually done the saga justice. Attempting to deconstruct the daily reality of a life lived 'Happily Ever After', this final chapter goes into some really depressing territory that is anything but kids' stuff and where the laughs are scant at best.Shrek, finding himself domesticated and beloved by people, grows weary of the day-to-day monotony and wishes for the salad days of a pre-Fiona life. Enter Rumpelstiltskin, voiced by GENUINE VOICE ACTOR Walt Dohrn who, as the Machiavellian imp, is perhaps the ONLY shining light in the film. Shrek makes a deal with him to have a day where he was once again feared and free of responsibility, and gives him a childhood day in exchange as payment. Rumple takes the day of his birth, sending Shrek into a skewed reality in which he was never born (ála 'It's a Wonderful Life') and where Fiona leads a band of ogres against the tyranny of Rumpelstiltskin's rule over Far Far Away.The film's bleak tone is made worse by its dark colour palate (since most of it occurs that night), seedy atmosphere (e.g. a 'cock' fight between the Gingerbread Man and a pack of animal crackers), and skewed characters  beloved characters  that just aren't themselves. Without the laughter or the love, 'Shrek Forever After' leaves half the family out of the equation. My kids were utterly bored, and sad to say, I don't blame them."
137,Shrek Forever After,4,9 June 2010,Please be the last one,"The Shrek series is ending at least two movies too late. The first two were plenty of fun, but the third one was merely okay and this final one is just tepid, sleepwalking through its own milieu with a script that seems to have had all the jokes removed.As movie series progress, the makers must come up with new situations for their protagonists to experience. So here, Shrek makes a deal with Rumplestiltskin that alters the timelines of him and everyone else in Far, Far Away: he gets one day in which to live as a regular old ogre, just like before he met Fiona and Donkey; in return, Rumplestiltskin gets one of Shrek's days for himself. Turns out he chooses the day the big green fella was born, which (obviously) means a new timeline in which he never saved Fiona from the castle (among other things).It's almost a crutch, having a main character live his life in an alternate timeline, because that way you can have that main character re-meet all his friends. It's like getting a second origin story. And sure enough, we meet several of the characters from the earlier films, such as Pinocchio, the Gingerbread Man, and the Three Little Pigs, not to mention Donkey's red-dragon wife. And naturally, because everyone in this timeline is used to a world in which Rumplestiltskin is large and in charge, Shrek needs to do a little convincing. Not the least of which is to Fiona herself, because  as the ironclad contract with Rumple notes  only true love's kiss can break the deal.The thing I liked most about the first couple of Shrek movies was the unending patter of jokes. Lots of pop-culture references (anachronistically), many of which worked. Lots of gross-out gags, too. And great chemistry between characters, even though they'd just met. It all sort of clicked then, but none of that is apparent in this fourth installment. The humor is, at best, scattershot  and not in the Airplane! style, either, where characters make seemingly hundreds of jokes a minute, with some working and some not. It almost feels as if there were a joke quota here, only it's a maximum of two per reel.Shrek 4 is charmless, too. I know we're supposed to root for Shrek (and the ending isn't unsatisfying), but his adventures trying to get his true love's kiss are sometimes tedious and uninspired. The problem here is that Shrek the character is supposed to be a grouchy bastard, but he's typically offset by the wild extrovertism of Donkey and the sweetness of Fiona. And since this alternate timeline indicates that neither has met Shrek, neither gets to balance out his irascible behavior.There were plenty of little tykes in the theater this morning, and I didn't really hear a lot of oohs and ahhs or laughs. It could be that Shrek Forever After failed to be broad enough in its humor and yet too intense in its action to appeal to its core audience. The series can finally rest."
