,title,stars,date,r_title,text
86,Shrek the Third,3,18 May 2007,"A funny movie that is lacking something monstrously important to be a true ""Shrek"" film","I got out of classes this fine Friday for some special school occasion, so the entire middle school went over to the movie theater to see Shrek The Third at a discovered matinée showtime at the local theater. A week ago, when the faculty first announced we'd be seeing this instead of Spider-Man 3, I was pretty excited. I mean, come on, it's Shrek--you really can't go wrong with the charming, funny, brainy-as-hell movies coming out of Dreamworks, with voice talent by Eddie Murphey, Mike Myers, and Cameron Diaz...right? Wrong. Let's start by examining what Shrek The Third DIDN'T have. The first ""Shrek"" was loved by me--and pretty much every other Shrek fan who is mature enough to understand its witty humour, special heartwarming touch, and its meant-for-adults-that-goes-way-over-little-kids'-heads type content. The filmmakers of the first Shrek really had some awesome material up their sleeves--stuff that truly made a fantastic movie, and if I do say so myself, one of the best animated films ever to be pumped out of LA.The second Shrek, ""Shrek 2,"" was a slight decline in entertainment. It was still funny, and still had half a tank of movie magic gasoline--not a full tank like the first Shrek possessed, but half--good enough to make a decent and enjoyable film, but not nearly enough to quite match up to the original.And now, sure enough, as every successful movie must have, a second sequel. ""Shrek The Third"" is a complete and utter mess. Remember those special little tricks the filmmakers had up their sleeves for the first Shrek, and even some for the second Shrek? Well, they're all GONE--not missing, no, they're completely GONE. What made the first two movies enjoyable for me had completely been used up, proving to us moviegoers and critics that sequels to big blockbusters are gigantic wastes of money.Sure, it was FUNNY. It was really funny, I laughed a lot. But where was the brain behind the comedy? Where was the backbone, the spine, the rock where instead of St. Peter builds the Church, where the filmmaker is supposed to base the movie on, where was that? It wasn't there--it was like the filmmakers pretended it was there, when it really wasn't, and just ignored that fact and continued to make the movie with no worries. A ""ghost comedy"" I like to call it. Now I know what you're asking yourself--how could I enjoy a ""ghost comedy"" like ""Anchorman,"" but not this? Well, this leaves me into my next point.The direction of the movie was an embarrassingly bad joke. It was like the director was sitting back smoking bongs and drinking Guinness while the sound editors filled in for him. The story didn't flow like the first two, it wasn't interesting, and after a while, I just got bored with the whole thing and started thinking about other, more important aspects of my life. The storyline felt like the film caterer used a knife to chop up it into little bits of segments and then mixed them around, making the movie almost as pointless as ""Larry The Cable Guy: Health Inspector."" A stupid comedy that is directed well can be a VERY FUNNY AND ENJOYABLE FILM. But when it's not? The essence of the film drains away to leave just empty-hearted and hollow laughs that don't mean anything.AND THE ENDING! OH GOD, THE ENDING! What were they thinking?! I was pretty much asleep! They tried to make it funny and give the audience the warm fuzzy feeling they felt in the first two movies, and they failed miserably! It was almost like they tried to justify the crappiness of the rest of the movie with a satisfying finale, and ended up doing the opposite and making the rest of the movie even crappier than it was. Which is truly saying something.Overall, ""Shrek The Third"" got me out of class, and that really was the only good part about seeing it. A huge, and unfortunate, disappointment. Save your money and rent the first two. I hope there's no ""Shrek The Fourth."""
87,Shrek the Third,5,4 January 2008,"In all that is good and whole, will the madness never stop?","I went because I was going to a sleep over at my grandparents with my two younger cousins (one of them was four, the other ten) I said yes, because I would be bored at home. Bad idea. The name is corny, the only part I laughed at wasn't even a full laugh out loud laugh, just me saying ""that was funny"" then life went on. The plot was thin, Justin Timberlake scared me as the dorky teen, and the music sucked big time (Except for Live and Let die and even then it was bad). It was awful. I guess you can say that violence can comfort me sometimes. It comforts me with LOST and Lord of the Rings. I bet when I'm a mother, and I'm at the grocery store, there will be a cheap DVD bin and there will be Shrek the Third, and my kid will say ""what's Shrek?"" and I won't even be able to answer how sucky it was. Do yourself a favor and save your money."
88,Shrek the Third,6,1 July 2007,"No originality + No plot + Annoying Characters= a very poor Shrek film, and a poor in general movie","Shrek was possibly the greatest animated film franchise of all time (money-wise anyway) until 3:50 p.m. today, when I started watching Shrek The Third after a lengthy advert prologue. The film started with Shrek and Fiona getting into a variety of funny situations in order to look after the kingdom of Far Far Away for an ill King Harold. The film then goes on to a weirdly funny death scene where Kind Harold dies. After being proclaimed by King Harold that he wants Shrek to be his heir Shrek decides the burden of becoming king is far too great so he, Donkey and Puss go off on an epic (10 minute) quest to find the next heir to the throne, an annoying, obviously unpopular teenager called Arthur (or Artie...hmmm). That's the plot, except for the return journey and the climatic (yawn) end scene obviously copied from the second film.The film is not poorly executed (the animation is great and there are some funny moments) however there is so little plot that the film becomes dull and plastic. The majority of the characters are incredibly annoying, especially the whining, whinging princesses' who add little, as well as the pointless cameo from Eric Idle as Merlin (who's main purpose appears to cut the action and film time down about 20 minutes) and Justin Timberlake, who played a stereotypical underdog role, which seemed completely out of place in a franchise usually seen as ridiculous and not serious at all.The major character flaw was that there were too many characters, with too little screen time meaning none of the characters (except for Donkey or puss) were actually likable. By the end of the film you realise that Arthur (Justin Timberlake) starts out as a major character, but in fact he becomes incredibly minor and unimportant. In fact the film would have been fine if many of the characters were not there at all. Many just seemed to have been added into the story to forward the plot in someway, a lazy attempt at disguising the non-existence of the plot itself.Also the film relies too much on the other two pictures. In reality Shrek 3 is pretty much an add on to the second film. There is so little difference between the films (other than the watery plot) that I began to wonder whether Shrek 3 is comprised of rejected concepts from the second installment (ah-ha dreamworks your devious plan has been un-earthed). What especially annoyed me about this film (apart from Justin Timberlake's and Eric Idle's pointless appearances) was the lack of originality. The Shrek films are renowned for an original perspective of ideas which are conventional stories taken apart for comic effect. This film had no evidence of this, not a single one, except the perception of bratty teenagers, and bratty princesses, which were both stereotypical and completely humourless. The film took all the ideas from the first two films, and then took them for granted. Unfortunately because of its lack of any new ideas, the film became one-dimensional.All in all while the animation was good and some of the scenes being quite funny, the film was ruined by its incredible lack of originality, as well as its annoying sub-characters and non-existent plot."
89,Shrek the Third,7,29 May 2007,A Nutshell Review: Shrek the Third,"It has just been the start of the summer season, and the sequels are raking in the millions, despite lacklustre reviews no doubt stemming from familiarity and expectations built from successes of the predecessor films. Still, they are raking in the millions, and possibly the largest franchises in recent years converge onto 2007 as they feature their third movies, and leaving the door open for possibly more to come. Spidey 3 had too many characters, as did Pirates 3, as they both seek to expand the fantasy world they belong to, which to some worked against their favour as it meant less screen time for some beloved characters.And we welcome back our favourite giant green ogre Shrek, who in its third installment, expands its mythology as well with the introduction of various characters from the Camelot tale, most notably those of Lancelot, Genevieve, Merlin and of course, Arthur himself. As we last left out heroes, Shrek (Mike Myers) and Fiona (Cameron Diaz) are back to living with royalty in the kingdom of Far Far Away, now with pals Puss in Boots (Antonio Banderas) and Donkey (Eddie Murphy) and family.Now if that's a handful, wait till the story moves forward with Shrek and the faithful buddies going on a mission to seek out an heir to the throne, Artie/Arthur (Justin Timberlake), who certainly doesn't bring the sexy back to the crown, and you must watch this as once again the filmmakers turn on their creativity and cunningness to develop a character (and other characters) in ways you'd never expect them to behave. Which is what most audiences would have enjoyed with the previous films, though this time round, there seemed to be a line drawn on the ground not to overdo the references to pop culture, sight gags and rounds of puns.And the villainous Prince Charming is back, with ambitions to be King Charming, and here's where the story fell a bit short, as it adapted from the other animated movie Happily N'ever After, where the bad guys who always seem to have their luck run out, group together and forcefully take over the kingdom. It's a pity the majority aren't memorable, given that we're already so familiar with the good guys, and they just fail to add more colour, instead it became repetitive with Charming's narcissistic behaviour. Boring.But there are good moments in the movie though, and I can't get enough of those princess types in Snow White, Sleeping Beauty and Cinderella. Despite its expanded cast, the story still managed to put focus on our main trio of Shrek, Donkey and Puss in Boots, at the expense of Fiona who becomes more of a side with her anxious maternal instincts kicking in. The story did feel at times to drag along, especially with Shrek playing surrogate father of sorts, and its trying real hard in attempts to weave in some feel good, moral messages, slowing down the pace, and at one point, tried to go back to its zany ways with some inane happenings, as if a sudden jolt of a reminder not to bore with preachy stuff.Perhaps Shrek 3 might have lost some of its charm, but it definitely is miles ahead of the poorly animated Legend of the Sea. It's a no brainer which animated movie to watch this school holidays."
90,Shrek the Third,,28 May 2007,I love it very much,Shriek Has A baby In part three It's good for him for shriek part 4 for the baby's were grew up on it to be his father's look for any thing for his farther shriek in his wife Fiona be happy for the baby's were grew up in shriek and Fiona were be happy for them to be the part of his parents on shriek part 4 were great for them to be protected to them like the donkey to take care of baby's for them for taking care of them. I am very happy for them to take care of them for the love of shriek and Fiona were taking care of them to. I born to raise them on swamp of the Baby's to take care of them. I love them so much about them having A baby's are fun to watch them so funny to them. bring us some of his new stuff for creating for all creatures and lot's of it to life.
91,Shrek the Third,8,26 May 2007,At least as good as Shrek 2,"As is often the case, I'm out of sync with most of the critics and movie-going public. C'est la vie...I loved the first Shrek and gave it a 10 vote. Shrek 2 was a bit of a disappointment and I only gave it an 8, although many critics and other folks seemed to like it better than the original. It was edgier, I suppose, but that's not what floats my boat.As with number 2, this wasn't up to the level of the original, but I gave another 8 as equally worthy to carry the franchise banner as #2. Like #2, it had a few spots that fell a little flat, but overall I liked it a bit more than #2.As with all Shrek movies, the devil is in the details and this was rich with goodies, some of which will only become obvious on the 2nd or 3rd viewing. If I had to score #2 and #3 side by side, I guess that, individually, #2 did have a bit more going for it. However, #3 did turn away from edginess to the sort of innocence that made the original so charming, so it simply felt better to me.[..minor spoiler alert..]One big disappointment was the lack of a closing musical number as in the first 2 movies. Donkey & Puss did have some over the credits business, but it was a letdown from the previous Shrek films."
92,Shrek the Third,8,26 May 2007,Pretty darn good!,"Unlike the first two ""Shrek"" films, ""Shrek the Third"" is getting roasted by many critics. Most are saying it's pointless, mediocre, not as smart, and not funny. While I agree with the first three comments, the part about not being funny is not true in my book. The plot goes something like this: When his new father-in-law, King Harold falls ill, Shrek is looked at as the heir to the land of Far, Far Away. Not one to give up his beloved swamp, Shrek recruits his friends Donkey and Puss in Boots to install the rebellious Artie as the new king. While Shrek is away, Prince Charming gathers a band of fairy tale villains to take over Far, Far Away, and it's up to Fiona to stop them.You can probably tell just from reading the plot that the filmmakers are running out of ideas for ""Shrek"", and that this film was made only for the hundreds of millions it would make. This stands to reason. Director Andrew Adamson of the first two ""Shrek"" films doesn't return for this one, which might explain why it wasn't as good, Chris Miller, who hadn't directed at all previously, took over. Many jokes are a rehash of things we have already seen before, and not done any better. Still, I laughed quite a bit, and I know you will too.The entire original cast is back yet again  probably for the last time  to voice the huge line-up of characters. Antonio Banderas as Puss-in-Boots once again steals the show, as does new character Merlin, voiced by Eric Idle. Another welcome addition is Amy Poehler, Cheri Oteri, and Maya Rudolph from ""Saturday Night Live"" as cranky princesses. One character I didn't like was Artie voiced by Justin Timberlake, he is the annoying, bratty, and stupid prince who just gets on your nerves.The animation is excellent as always, and for every two bad jokes, there was one good one a school pep rally tells you to ""Just Say Nay"". So, like ""Spider-man 3"", which wasn't as good as the first two either, ""Shrek 3"" is entertaining. It's a good way to spend 90 minutes, and for the most part, you won't regret it and your kids will adore it. Critics need to realize we don't see movies like Spidey and Shrek to watch a great movie, we watch it to be entertained. But frankly, I don't think critics even know the meaning of the word."
93,Shrek the Third,5,20 May 2007,Even ogres need good jokes in the script to be funny,"The first two Shrek installments were a hard act to follow: this film proves it. Although there are some sporadic moments of comedic fun, this film just somehow lacks the spark of the other two movies, and falls short.The structure and script content of the whole thing seems rushed, as though they failed to develop some of their innovative ideas for the maximum comic potential. For example, the fairy tale land high school idea could have been utilized for some good material, but instead there are only a few random jokes, some of which don't work. In the same way, neither the popular returning characters nor the new ones are properly used. Donkey, Puss in Boots, even the Dragon hardly do anything except get tied up by baddies, and have few funny lines. Merlin, the princesses, and the villains are all introduced with some fair sight gags, but then the script wastes each of them, too. The death of one character is sad, yet is awkwardly played for comedy.On the plus side: the animation and backgrounds are superior, and the baby ogres and baby donkey/dragons are cute.The film does little to advance new elements to the Shrek story, and has only occasional laughs. Just average, and falls far below the standard of the first two Shrek movies."
94,Shrek the Third,6,14 August 2017,"Spaceballs 2- . . . I mean, Shrek 3: The Search for More Money","Easily the weakest of the three movies, plotwise (I know there are four, but this is enough), leaving most of its charms to the ever-increasing background characters. Almost like clockwork, whenever I'd start to drift, Gingerbread Man would show up and steal the scene; or Merlin (Eric Idle); or Arthur (Justin Timberlake).It's clear that the machine is running on fumes at this point, but it's not really a dud; there are a few bits of hilarity. You just have to wait around for them.6/10"
95,Shrek the Third,4,7 August 2017,Disappointing,"What made the first Shrek enduring & charming has been completely lost over the course of the sequels, resulting in a lackluster third installment. Animators claims at advanced technology allowing them to produce better imagery & detail is very questionable, as to ask ""so what?"". The film is packed full of load, OTT gags & physical comedy to keep you awake, as well as entertain the kiddies with the bright colors & action - but for a more mature audience at whom the dialogue & jokes of the films are aimed, it neither impresses nor amuses. In fact the characters seem to have taken a step back, becoming more slapstick in their behavior & approach. I can't help but feel that the voice cast realize this, & each deliver a bored & tired performance. The comedy is recycled from it's predecessors, it's direction a mystery, it's intentions non-existent. Dreamworks should have quit whilst it was ahead, & should stop cussing on advertising it's star casts & work more on story & script."
96,Shrek the Third,5,3 August 2017,The Unnecessary One.,"This film really disappointed. I loved the first two, the second one was the high point which is rare for sequels. This film focused less on Shrek and more on Justin Timberlake's take on a version of King Arthur that I don't even think the kiddos would have wanted. I have to wonder, Justin Timberlake was referenced slightly in the second film, could that have had anything to do with his presence in this movie?I feel the main problem with this film is the lack of Shrek, yes Shrek is throughout the film but rather than have the lovable Shrek that existed in this film, we focus more on his family dynamic which intertwines with the plot line of Arthur. Shrek becomes somewhat of a secondary character in his own franchise no longer the happy go lucky ogre but a (sigh) even more complex and developed character. Don't get me wrong, you need to flesh out a character, but I think you can go a little too far with just about anything, like drugs...I feel if they had tossed the whole ""fatherhood"" plot line the film would have been markedly better. Perhaps focusing more on Shrek getting back to his swamp and out of Far Far Away. The conflict from the previous movies was about finding true love and overcoming stereotypes, the second one did something similar with the parents and Fiona choosing the real Shrek over the ""new"" Shrek. Both of the prior films focused on topics that had more to do with an ugly ogre than a family ogre. This is reminiscent of the ""Ice Age"" films where the mammoth started a family over the course of the films and they gradually got worse and worse even though the animation effects were getting better and better. I feel the Arthur plot line could have been done better if they had fleshed it out more. In fact this film feels really fast certainly not as long or effective as the previous films. The villain was also somewhat of an odd choice, it really did not make much sense for the vapid Prince Charming to have the cunning or nerves to start a villain rebellion and take over the city. A better villain should have been Morgan La Faye or Mordred, two characters that would have fit better into the Arthurian mythos. I feel that maybe what could have been done instead of Shrek seeking out Arthur would have been for the young Arthur to instead seek out Shrek to slaughter as a way to prove himself worthy as king. Leave Far Far Away out of the picture and maybe even have the ""problems with Fiona"" subplot to not to be about potential fatherhood but instead getting back together in the end and overcoming petty differences. Really, they should have stopped at the second Shrek film where the characters were ""happily ever after"" and not much else could be done with them. I know that Shrek is a semi sarcastic adult take on fairy tales, but potential fatherhood is, well, not as big a draw as a sarcastic ogre finding love in a princess, which was a much better subversion of the traditional conception of standard fairy tales. This one was meh, and the fourth one was bleh.Quick note. This website doesn't allow brackets? Oh well..."
